{
  "schemaVersion": "1.0.0",
  "generatedAt": "2026-07-16T03:30:00Z",
  "snapshotId": "snapshot-pc-install-001",
  "rows": [
    {
      "assetObjectId": "sha256:aaaaaaaaaaaaaaaaaaaaaaaaaaaaaaaaaaaaaaaaaaaaaaaaaaaaaaaaaaaaaaaa",
      "familyId": "family-sha256:8302c5466c2c1b5c705fba997525c86c893c9e813b07c2642abc56ac38acc588",
      "checkId": "BankProvenance",
      "outcome": "Passed",
      "reasonCode": "None",
      "observedFingerprint": "ec19bd4387c27fecfaadf6ed5d6b5351c9dcd9441df8aa83b0dbe124f651dce1",
      "failureClasses": [],
      "evidenceKinds": [
        "SerializedMetadata"
      ],
      "evidence": [
        "Tools/AssetImport/Fixtures/DiscoveryGate/object-observations.json"
      ]
    },
    {
      "assetObjectId": "sha256:aaaaaaaaaaaaaaaaaaaaaaaaaaaaaaaaaaaaaaaaaaaaaaaaaaaaaaaaaaaaaaaa",
      "familyId": "family-sha256:8302c5466c2c1b5c705fba997525c86c893c9e813b07c2642abc56ac38acc588",
      "checkId": "ChannelLayoutValidity",
      "outcome": "Passed",
      "reasonCode": "None",
      "observedFingerprint": "fd639a95c8b0dc33616d68288ea3b1805a8f8c728a71d65a20ccc2b3303baf53",
      "failureClasses": [],
      "evidenceKinds": [
        "AudioMetadata"
      ],
      "evidence": [
        "Tools/AssetImport/Fixtures/DiscoveryGate/object-observations.json"
      ]
    },
    {
      "assetObjectId": "sha256:aaaaaaaaaaaaaaaaaaaaaaaaaaaaaaaaaaaaaaaaaaaaaaaaaaaaaaaaaaaaaaaa",
      "familyId": "family-sha256:8302c5466c2c1b5c705fba997525c86c893c9e813b07c2642abc56ac38acc588",
      "checkId": "DecodeOutcome",
      "outcome": "Passed",
      "reasonCode": "None",
      "observedFingerprint": "e8345b02e4b7c818ae3b1520aabbad8d3b5b89f1cf97482002bdce20d42ebb74",
      "failureClasses": [],
      "evidenceKinds": [
        "DecoderProbe"
      ],
      "evidence": [
        "Tools/AssetImport/Fixtures/DiscoveryGate/object-observations.json"
      ]
    },
    {
      "assetObjectId": "sha256:aaaaaaaaaaaaaaaaaaaaaaaaaaaaaaaaaaaaaaaaaaaaaaaaaaaaaaaaaaaaaaaa",
      "familyId": "family-sha256:8302c5466c2c1b5c705fba997525c86c893c9e813b07c2642abc56ac38acc588",
      "checkId": "DependencyClosure",
      "outcome": "Passed",
      "reasonCode": "None",
      "observedFingerprint": "1b59edf7a13bac1d56ba64fe6c723632244b5f33a4588bf417069822c95959b5",
      "failureClasses": [],
      "evidenceKinds": [
        "DependencyGraph"
      ],
      "evidence": [
        "Tools/AssetImport/Fixtures/DiscoveryGate/object-observations.json"
      ]
    },
    {
      "assetObjectId": "sha256:aaaaaaaaaaaaaaaaaaaaaaaaaaaaaaaaaaaaaaaaaaaaaaaaaaaaaaaaaaaaaaaa",
      "familyId": "family-sha256:8302c5466c2c1b5c705fba997525c86c893c9e813b07c2642abc56ac38acc588",
      "checkId": "EventRelationship",
      "outcome": "Passed",
      "reasonCode": "None",
      "observedFingerprint": "d2070425fded5ee879129622a6ec3d9f55da9c1d804babfcbf49326b52e5a6e2",
      "failureClasses": [],
      "evidenceKinds": [
        "DependencyGraph",
        "SerializedMetadata"
      ],
      "evidence": [
        "Tools/AssetImport/Fixtures/DiscoveryGate/object-observations.json"
      ]
    },
    {
      "assetObjectId": "sha256:aaaaaaaaaaaaaaaaaaaaaaaaaaaaaaaaaaaaaaaaaaaaaaaaaaaaaaaaaaaaaaaa",
      "familyId": "family-sha256:8302c5466c2c1b5c705fba997525c86c893c9e813b07c2642abc56ac38acc588",
      "checkId": "LoopValidity",
      "outcome": "Passed",
      "reasonCode": "None",
      "observedFingerprint": "ab7e49709f8e66859969fbd5f6d0576d988adba40f38f8ae7e206e8174f62fd1",
      "failureClasses": [],
      "evidenceKinds": [
        "AudioMetadata",
        "LoopBehavior"
      ],
      "evidence": [
        "Tools/AssetImport/Fixtures/DiscoveryGate/object-observations.json"
      ]
    },
    {
      "assetObjectId": "sha256:aaaaaaaaaaaaaaaaaaaaaaaaaaaaaaaaaaaaaaaaaaaaaaaaaaaaaaaaaaaaaaaa",
      "familyId": "family-sha256:8302c5466c2c1b5c705fba997525c86c893c9e813b07c2642abc56ac38acc588",
      "checkId": "MediaReadability",
      "outcome": "Passed",
      "reasonCode": "None",
      "observedFingerprint": "649ce29244127b54ceb89b0da6c0aac536be5879a0385a5848f76c57d4737fad",
      "failureClasses": [],
      "evidenceKinds": [
        "FileReadability",
        "ObjectReadability"
      ],
      "evidence": [
        "Tools/AssetImport/Fixtures/DiscoveryGate/object-observations.json"
      ]
    },
    {
      "assetObjectId": "sha256:bbbbbbbbbbbbbbbbbbbbbbbbbbbbbbbbbbbbbbbbbbbbbbbbbbbbbbbbbbbbbbbb",
      "familyId": "family-sha256:3d1cd3161f530d82c9781efb62652102efaf99d8808268f2d1c30662c49b6d20",
      "checkId": "ColliderValidity",
      "outcome": "Failed",
      "reasonCode": "PolicyViolation",
      "observedFingerprint": null,
      "failureClasses": [
        "ImportSettingMismatch"
      ],
      "evidenceKinds": [
        "SerializedMetadata"
      ],
      "evidence": [
        "Tools/AssetImport/Fixtures/DiscoveryGate/object-observations.json"
      ]
    },
    {
      "assetObjectId": "sha256:bbbbbbbbbbbbbbbbbbbbbbbbbbbbbbbbbbbbbbbbbbbbbbbbbbbbbbbbbbbbbbbb",
      "familyId": "family-sha256:3d1cd3161f530d82c9781efb62652102efaf99d8808268f2d1c30662c49b6d20",
      "checkId": "LightmapValidity",
      "outcome": "Passed",
      "reasonCode": "None",
      "observedFingerprint": "d283b8191712af6aa6c1547efc3ae14fbf717b4d2cdb5851e4c8980fc7ebfb44",
      "failureClasses": [],
      "evidenceKinds": [
        "SerializedMetadata"
      ],
      "evidence": [
        "Tools/AssetImport/Fixtures/DiscoveryGate/object-observations.json"
      ]
    },
    {
      "assetObjectId": "sha256:bbbbbbbbbbbbbbbbbbbbbbbbbbbbbbbbbbbbbbbbbbbbbbbbbbbbbbbbbbbbbbbb",
      "familyId": "family-sha256:3d1cd3161f530d82c9781efb62652102efaf99d8808268f2d1c30662c49b6d20",
      "checkId": "MaterialDependencyClosure",
      "outcome": "Passed",
      "reasonCode": "None",
      "observedFingerprint": "400da1edadcbd1b9f1dbe7926b81d0b8b361c3888ada93053f001ea72b572a35",
      "failureClasses": [],
      "evidenceKinds": [
        "DependencyGraph",
        "MaterialShaderGraph"
      ],
      "evidence": [
        "Tools/AssetImport/Fixtures/DiscoveryGate/object-observations.json"
      ]
    },
    {
      "assetObjectId": "sha256:bbbbbbbbbbbbbbbbbbbbbbbbbbbbbbbbbbbbbbbbbbbbbbbbbbbbbbbbbbbbbbbb",
      "familyId": "family-sha256:3d1cd3161f530d82c9781efb62652102efaf99d8808268f2d1c30662c49b6d20",
      "checkId": "MeshReadability",
      "outcome": "Passed",
      "reasonCode": "None",
      "observedFingerprint": "64ce0a3b9d01fdc8d84c373998ab50b22983e8817818a7668f8883115606f996",
      "failureClasses": [],
      "evidenceKinds": [
        "FileReadability",
        "ObjectReadability"
      ],
      "evidence": [
        "Tools/AssetImport/Fixtures/DiscoveryGate/object-observations.json"
      ]
    },
    {
      "assetObjectId": "sha256:bbbbbbbbbbbbbbbbbbbbbbbbbbbbbbbbbbbbbbbbbbbbbbbbbbbbbbbbbbbbbbbb",
      "familyId": "family-sha256:3d1cd3161f530d82c9781efb62652102efaf99d8808268f2d1c30662c49b6d20",
      "checkId": "NavMeshValidity",
      "outcome": "Passed",
      "reasonCode": "None",
      "observedFingerprint": "36b18b17e13d8b85f5e70d070dbb370b3f2ae28b23ce4f4d0bba1d809486b0ff",
      "failureClasses": [],
      "evidenceKinds": [
        "SerializedMetadata"
      ],
      "evidence": [
        "Tools/AssetImport/Fixtures/DiscoveryGate/object-observations.json"
      ]
    },
    {
      "assetObjectId": "sha256:bbbbbbbbbbbbbbbbbbbbbbbbbbbbbbbbbbbbbbbbbbbbbbbbbbbbbbbbbbbbbbbb",
      "familyId": "family-sha256:3d1cd3161f530d82c9781efb62652102efaf99d8808268f2d1c30662c49b6d20",
      "checkId": "PrefabDependencyClosure",
      "outcome": "Passed",
      "reasonCode": "None",
      "observedFingerprint": "ccf6c1d4f5ab8525766f1dffbfe2f9ca7ba59584af5838cab6cbad622f8ab458",
      "failureClasses": [],
      "evidenceKinds": [
        "DependencyGraph",
        "PrefabYaml"
      ],
      "evidence": [
        "Tools/AssetImport/Fixtures/DiscoveryGate/object-observations.json"
      ]
    },
    {
      "assetObjectId": "sha256:bbbbbbbbbbbbbbbbbbbbbbbbbbbbbbbbbbbbbbbbbbbbbbbbbbbbbbbbbbbbbbbb",
      "familyId": "family-sha256:3d1cd3161f530d82c9781efb62652102efaf99d8808268f2d1c30662c49b6d20",
      "checkId": "ShaderDependencyClosure",
      "outcome": "Passed",
      "reasonCode": "None",
      "observedFingerprint": "5324d5f8e8f3b25673b7d116c3b223e7f09c87a738911db7b0379404ec969570",
      "failureClasses": [],
      "evidenceKinds": [
        "DependencyGraph",
        "MaterialShaderGraph"
      ],
      "evidence": [
        "Tools/AssetImport/Fixtures/DiscoveryGate/object-observations.json"
      ]
    },
    {
      "assetObjectId": "sha256:bbbbbbbbbbbbbbbbbbbbbbbbbbbbbbbbbbbbbbbbbbbbbbbbbbbbbbbbbbbbbbbb",
      "familyId": "family-sha256:3d1cd3161f530d82c9781efb62652102efaf99d8808268f2d1c30662c49b6d20",
      "checkId": "TextureDependencyClosure",
      "outcome": "Passed",
      "reasonCode": "None",
      "observedFingerprint": "81b64e83ee8ef1cec53ef3027a5b481dc1bc43f4a7ad3019ba0a9dedfce65903",
      "failureClasses": [],
      "evidenceKinds": [
        "DependencyGraph",
        "TextureMetadata"
      ],
      "evidence": [
        "Tools/AssetImport/Fixtures/DiscoveryGate/object-observations.json"
      ]
    },
    {
      "assetObjectId": "sha256:cccccccccccccccccccccccccccccccccccccccccccccccccccccccccccccccc",
      "familyId": "family-sha256:9d64bb4fdc826ff6e36d128c86974a25915469aded454f6bd435c837eaeb21e0",
      "checkId": "AnimationClipReadability",
      "outcome": "Unchecked",
      "reasonCode": "ToolUnavailable",
      "observedFingerprint": null,
      "failureClasses": [],
      "evidenceKinds": [
        "FileReadability",
        "ObjectReadability",
        "SerializedMetadata"
      ],
      "evidence": [
        "Tools/AssetImport/Fixtures/DiscoveryGate/object-observations.json"
      ]
    },
    {
      "assetObjectId": "sha256:cccccccccccccccccccccccccccccccccccccccccccccccccccccccccccccccc",